{
  "article_title": "衍天宗试炼之地从机制到实战的完整攻略",
  "main_title": "衍天试炼",
  "subtitle": "试炼之地机制与实战",
  "author": "示例作者",
  "resolution": "high",
  "composition_mode": "auto",
  "subject_position": "left",
  "layering_requested": true,
  "commercial_context": false,
  "font": {
    "name": "示例开放字体",
    "rights_status": "open",
    "creator": "示例字体项目",
    "source": "https://example.invalid/open-font-license",
    "commercial_allowed": true
  },
  "source_assets": [
    {
      "label": "用户游戏截图",
      "creator": "用户本人",
      "source": "本次会话附件",
      "rights_status": "owned",
      "commercial_allowed": true,
      "attribution": ""
    }
  ],
  "notes": "人物和武器与标题做克制穿插"
}

