{
  "article_title": "从入门到进阶手把手教你的超级明尊T攻略",
  "main_title": "明尊攻略",
  "subtitle": "从入门到进阶的实战指南",
  "author": "示例作者",
  "resolution": "high",
  "composition_mode": "flow",
  "subject_position": "none",
  "commercial_context": false,
  "font": {
    "name": "示例开放字体",
    "rights_status": "open",
    "creator": "示例字体项目",
    "source": "https://example.invalid/open-font-license",
    "commercial_allowed": true
  },
  "source_assets": [],
  "notes": "庄严、克制，中心保持简洁"
}

