{
  "article_title": "蓬莱门派剧情与设定整理",
  "main_title": "蓬莱旧梦",
  "subtitle": "门派剧情与设定整理",
  "resolution": "standard",
  "composition_mode": "direct",
  "subject_position": "right",
  "commercial_context": false,
  "font": {
    "name": "示例开放字体",
    "rights_status": "open",
    "creator": "示例字体项目",
    "source": "https://example.invalid/open-font-license",
    "commercial_allowed": true
  },
  "source_assets": [
    {
      "label": "搜索引擎找到的插画",
      "creator": "",
      "source": "",
      "rights_status": "unknown",
      "commercial_allowed": false,
      "attribution": ""
    }
  ],
  "notes": "此素材必须被拦截并替换"
}
